{
  "version": "0.1.42",
  "tool": {
    "version": "0.1.42",
    "commit": "fada161ff42dd35d38325f84f9ed3e0ac6ede669"
  },
  "base": {
    "source": "../../dist"
  },
  "compositions": [
    {
      "output": "AGENTS.md",
      "sources": [
        "base:AGENTS.base.md",
        "AGENTS.delta.md"
      ]
    },
    {
      "output": "REVIEW.md",
      "sources": [
        "base:REVIEW.base.md"
      ]
    }
  ],
  "skills": [
    {
      "id": "test-driven-development",
      "path": "base:skills/test-driven-development/SKILL.md",
      "trigger": "before writing implementation code",
      "owner": "@platform"
    },
    {
      "id": "writing-a-gate",
      "path": "base:skills/writing-a-gate/SKILL.md",
      "trigger": "before adding a gate",
      "owner": "@platform"
    }
  ],
  "gates": [
    {
      "id": "harness-drift",
      "command": "harness check --manifest harness.manifest.json",
      "protects": "the composed AGENTS.md and REVIEW.md match base@0.1.42 plus this delta",
      "prove_fires": "hand-edit AGENTS.md, then run harness check; expect exit 1",
      "severity": "blocking",
      "prove_fires_command": "printf '<!-- prove -->' >> AGENTS.md",
      "revert_command": "node ../../bin/harness.mjs sync --manifest harness.manifest.json",
      "expect": {
        "forbid": [
          "ERROR:"
        ]
      }
    },
    {
      "id": "doctor",
      "command": "harness doctor --manifest harness.manifest.json",
      "protects": "declared governance facts stay consistent",
      "prove_fires": "empty CODEOWNERS, then run harness doctor; expect exit 1",
      "prove_fires_command": "printf '' > CODEOWNERS",
      "revert_command": "git checkout -- CODEOWNERS",
      "severity": "blocking",
      "expect": {
        "forbid": [
          "ERROR:"
        ]
      }
    },
    {
      "id": "lint",
      "command": "make lint",
      "protects": "zero warnings in the committed change",
      "prove_fires": "introduce an unused import; expect exit 1",
      "severity": "blocking",
      "prove_fires_command": "printf '// unused' >> src/index.js",
      "revert_command": "git checkout -- src/index.js",
      "expect": {
        "forbid": [
          "ERROR:"
        ]
      }
    }
  ],
  "surfaces": [
    {
      "id": "harness",
      "paths": [
        "harness.manifest.json",
        "AGENTS.delta.md",
        "AGENTS.md",
        "REVIEW.md",
        "harness",
        "CODEOWNERS",
        ".github/**"
      ],
      "requires": [
        "harness-drift",
        "doctor"
      ]
    },
    {
      "id": "docs",
      "paths": [
        "docs/**",
        "README.md"
      ],
      "requires": [
        "doctor",
        "lint"
      ]
    }
  ],
  "governance": {
    "owners": [
      "@platform"
    ],
    "ci": [
      ".github/workflows/harness.yml"
    ]
  },
  "lock": {
    "version": "0.1.42",
    "tool": {
      "version": "0.1.42",
      "files": {
        "bin/harness.mjs": "58672234672b3d7ea807d36e1594be8bbeaa0e1de0cb48e536554de528b02a15",
        "src/adopt.mjs": "2b12b28d8e8fbd80f0d40d1aa404f51b06c699f3f77e1c115173ae04ca8f05ca",
        "src/artifacts.mjs": "d97f2c10d4561c0eb2caa05461f1ba0a634555e7c18c7b111bd673cb8aee9f61",
        "src/attest.mjs": "83e4637cc9dcc1e28d1ee63a155359aa3a94072e37d2ae8c6c0f3da6d3a8481a",
        "src/command-review.mjs": "2c65b25882ecb345b7c3ba521b53335089681ea73f249a628e9993ea29c132fb",
        "src/compose.mjs": "0ba04d4dc3b881f2d9137dcb7d9d8338f1c6a27bf00e6852d75ec7d2df1b20d4",
        "src/doctor.mjs": "849683d298ae4d2b10c6c2257f26fbbc3637252d716b7278950a318dcbd0e04b",
        "src/documents.mjs": "76765cb4c5ebb4d818b23d4b7d25ee9d3140a40cedf225a219cf8e24b4580ea9",
        "src/fetch.mjs": "cd43a0439c0cdd31637237d5b15cbab799273262dd833f7cd7b7210a1db7d51b",
        "src/gates.mjs": "6baf3cab431dabeb285cb6ee306b1e92dbce5c6642f40f53b8add002772a2bf7",
        "src/manifest.mjs": "49e11c4f0fed2e237a0e6de969aa757b1fcbf586354ff1cfa21200235d0ca25f",
        "src/metrics.mjs": "28230934a869bd040545dc8a82e849bad1d565e022f02dc191c89c6fdccd61fa",
        "src/pack.mjs": "e1abb02a171a1b1def290613c84a565538fc4749c9b0845cc3d3762e21affe2c",
        "src/process.mjs": "e8ef757ed2cf0ed5652d85290834409ef1d8204575b2598f6fb66c8387ce1aee",
        "src/product.mjs": "3d73692cda84ee36ab6dd22f962cbc41b59b97f63db78141422db8255ad6b55a",
        "src/proof.mjs": "af56a190eeef321d30e2fce82e34b1b3f7f3fd978972cb4dbf1dd846f65924cf",
        "src/prove.mjs": "e20fcca707044715b74010ae8e20a6ea4fb96412ae7ed28b105dd6fb1843535f",
        "src/release.mjs": "84cb248d97823a3b034be0c99fbfb9ede58213da965ae5846efb2ee0bc874d75",
        "src/scan.mjs": "0510229545f47dae343a64041e68be94e10ae97a97112d41ea1ffa4b3fed2366",
        "src/select.mjs": "b4ce3dd85b30f9e3826dc54886311bc1004513124f276d7e16ad874fe6c9e94e",
        "src/shim.mjs": "565579029f2cbd87ec02cf186331c5a3a5a53e07d4ba590da3a0778235aa3fc5",
        "src/state.mjs": "8d915d3d5c591ed806da105c9348cb14912cdb3119e306e148a974c11d28fdfa",
        "src/survey.mjs": "8b83a6b927c90044b5d034dee0f6439d317eb1f681a118bc8f80869984deaa02",
        "src/system-ci-template.mjs": "714343ebef940e9facbd17dbba3febe417bfa84d022a242cd8e736c0371b73cb",
        "src/system.mjs": "054e0c3795013b5750a68e87ab3e098c037689bff981446ed7ea2f9f476b5453",
        "src/tool.mjs": "32bc86a2f7f020a477bed8398c8270ea22f47e2a7c189017747aadc77f60e561",
        "src/workflow.mjs": "5a6cbbfe9bfab8bd29c40b195802a8a314c4eab331e2674fddf7d20ae7781714",
        "src/worktree.mjs": "c73ac3dd702f461bbf262a304c391a0cc82a1b96b7ca7b31e40d1460248a73fb",
        "package.json": "826d62b8534b0ac6625fd5dc63a65d50e3503ce26aadfce75ce16829ee3bb3db"
      },
      "commit": "fada161ff42dd35d38325f84f9ed3e0ac6ede669"
    },
    "outputs": {
      "AGENTS.md": "b3ef42e8d0585a74d2f470dbd4bc04fe76432de56f7b00e03e465ce2469ff656",
      "REVIEW.md": "63963d3839b7266410a1bf5ef12ed6aca57a24b505250be949c8bca826c2611b"
    },
    "base": {
      "version": "0.1.42",
      "files": {
        "AGENTS.base.md": "873b6971a932faa0426e5c92751bd391a397dfd39666cd8517b3661ecc69fe50",
        "REVIEW.base.md": "63963d3839b7266410a1bf5ef12ed6aca57a24b505250be949c8bca826c2611b",
        "VERSION": "a7f94bf3ea19f1e365fe391914734285127f1cd84e2bdfc74c244d81774910b6",
        "requirements.json": "01803c28380e0f191bb684d7c4c40b1e45b093de4601de3c280abceffa931386",
        "skills/test-driven-development/SKILL.md": "d8e3ded0203a5b8fb4fef60089ef4dc08e877b90903ae8fbe20fd63de39e097d",
        "skills/verification-tiers/SKILL.md": "c4af570bcf1a0b84be1f38601142ba37ffba370e8e2e10d2241e1ba2b69bcb41",
        "skills/writing-a-gate/SKILL.md": "f552ae24b718ddc5c8ae928e2fc85d8f49b77113688884cb2fcbb8e4a89c0513",
        "templates/change-record.md": "b65a4e185e03968fb931745dfbbf28e64b632e64e092e0fed4a9dce08a73a217",
        "templates/decision-record.md": "42649218463664519be18ed153b865ee90fc978022e94c50d17be5965b5deb45",
        "templates/manual-verification.md": "21d347b902c54b6bcba4a7a90cef4c02f53afeb0c352f2dd6a0a316f091b044b",
        "templates/postmortem.md": "80af444609639a827e383450b682b93f59dc0b08279b519a1342e708dc65d1ee"
      }
    }
  }
}
